{
  "schemaVersion": "1.0.0",
  "contractId": "cursor-hook-bom-compatibility-hotfix-v1",
  "planHash": "bba87e2ced8c93e22e751b08f50bbb17c492733fec4f302a9d608c8ec17ced53",
  "contractHash": "08ec9f9d0396d09c17470b234f5e21a806c3c22189e607a0a1b98b477e77ff92",
  "scopeHash": "d082b87cdad7a4ee6ed6145c5811bf9eedf8a7ce67737016f13560c0e8541ecc",
  "acceptanceHash": "e8d50574f5a0c16066e5cafe42bd37f3b15c252a7489203b77754764ca9f4150",
  "baseCommit": "f069f5250c1d1669a18fea58ab7a94568532a2e3",
  "baseTree": "8c62ab62f1743978bc58a97daf25fa34c36a12db",
  "lockCommit": "",
  "protectedManifest": [
    {
      "path": ".execution-governance/policy/governance-policy.json",
      "sha256": "38196299166e5f95cd9f350102a92369c79495ec9416d35b84ea510cbd177676"
    },
    {
      "path": "docs/execution-governance/EXECUTION_ASSURANCE_PROTOCOL.md",
      "sha256": "5b1b2aded150f421e2f2b79a8502ee1ab083f1ac5c5c5ed5fb7e4e9372b44eb7"
    },
    {
      "path": ".execution-governance/schemas/acceptance.schema.json",
      "sha256": "38d17a9a5eb00cf27781d41b4dc75d72b48a7e8f144b06029b49e8e66be96630"
    },
    {
      "path": ".execution-governance/schemas/contract.schema.json",
      "sha256": "126c831987c8b7a81b8b8340a7824712ef45ad8d53a159c2d18675ca16e0cdd4"
    },
    {
      "path": ".execution-governance/schemas/implementation-report.schema.json",
      "sha256": "7e8859b56375e2fa72fbabc1baae9a4ca10aedc31dc20c5acb26c5e05f5888f9"
    },
    {
      "path": ".execution-governance/schemas/lifecycle-record.schema.json",
      "sha256": "16e94331b1be1b38cf5dec9f3ab0d148e792f5e60351442905e4055184426b23"
    },
    {
      "path": ".execution-governance/schemas/lock.schema.json",
      "sha256": "95603a41d9f623737f4465b12fd4c5a356e63336fa217c6e94c8afcbcd8489ec"
    },
    {
      "path": ".execution-governance/schemas/review-record.schema.json",
      "sha256": "c2b71cd60b6c22627afed8172eedbe4f3a99d4b96ff6997a614b0e52bf61b7d5"
    },
    {
      "path": ".execution-governance/schemas/run-record.schema.json",
      "sha256": "1ec2f5e6ed2b2d2d43ad0fc64d972b5d473fa1f1c81ca8431a31f947ba6bb70d"
    },
    {
      "path": ".execution-governance/schemas/scope-change-request.schema.json",
      "sha256": "763531fb653c21c3a9b068ef790b7277af51cc5bcce01077955bb5dabb39ff83"
    },
    {
      "path": ".execution-governance/schemas/scope.schema.json",
      "sha256": "3f46c65097666367690935a0b0fb83af5ddf1586a26d09f7b23c9e4df4f1720e"
    },
    {
      "path": ".execution-governance/schemas/status-model.schema.json",
      "sha256": "dad2f1c04c4ca9fb0fb9325dba7b7097ede7d94fec4b68e4fcd7a8b8cc27982c"
    },
    {
      "path": ".execution-governance/schemas/verifier-change-request.schema.json",
      "sha256": "00873d26d17aa3d13e4002025c97af610c73d30c142444c1a6b510af9c629501"
    },
    {
      "path": ".execution-governance/schemas/waiver-record.schema.json",
      "sha256": "737af715de8c500ad800207cee8be51564e70c7d96ab60964ac01d9824d85dcc"
    }
  ],
  "artifactFreshnessPolicy": {
    "requiresCommitSha": true,
    "requiresRunId": true,
    "requiresTimestamp": true,
    "rejectsPreLockArtifacts": true
  }
}
